{
    "$schema": "http://json-schema.org/draft-04/schema#",
    "title": "resume content",
    "description": "resume content",
    "type": "object",
    "required": [
        "profiles",
        "title",
        "name"
    ],
    "properties": {
        "name": {
            "type": "string"
        },
        "title": {
            "type": "string"
        },
        "profiles": {
            "type": "array",
            "items": {
                "type": "object",
                "required": [
                    "icon",
                    "label"
                ],
                "properties": {
                    "icon": {
                        "type": "string"
                    },
                    "label": {
                        "type": "string"
                    },
                    "link": {
                        "type": "string"
                    },
                    "alt": {
                        "type": "string"
                    }
                }
            }
        },
        "sections": {
            "type": "array",
            "items": {
                "type": "object",
                "required": [
                    "title",
                    "items"
                ],
                "properties": {
                    "title": {
                        "type": "string"
                    },
                    "items": {
                        "type": "array",
                        "items": {
                            "type": "object",
                            "required": [
                                "content"
                            ],
                            "properties": {
                                "image": {
                                    "type": "string"
                                },
                                "title": {
                                    "type": "string"
                                },
                                "time": {
                                    "type": "string"
                                },
                                "content": {
                                    "oneOf": [
                                        {
                                            "type": "array",
                                            "items": {
                                                "type": "string"
                                            }
                                        },
                                        {
                                            "type": "string"
                                        }
                                    ]
                                }
                            }
                        }
                    }
                }
            }
        }
    }
}